{
  "version": "0.2.0",
  "reviewed_at": "2026-03-26",
  "repository_identity": {
    "owner": "num1hub",
    "name": "capsule-specs",
    "homepage": "https://github.com/num1hub/capsule-specs",
    "license": "Apache-2.0",
    "primary_maintainer": "egor-n1"
  },
  "evaluation_goals": [
    "Understand the public scope without reading the private runtime repository.",
    "See the strongest contract, review, and release-evidence surfaces quickly.",
    "Verify that the repo behaves like a maintained OSS contract surface rather than a bulk export."
  ],
  "fast_review_path": [
    "README.md",
    "docs/reviewer-guide.md",
    "PUBLIC_PROJECT_PROFILE.json",
    "PUBLIC_REPOSITORY_IDENTITY.json",
    "PUBLIC_REVIEW_SCORECARD.json",
    "PUBLIC_VERIFICATION_MATRIX.json",
    "PUBLIC_AUDIENCE_PATHS.json",
    "PUBLIC_CAPABILITY_MATRIX.json",
    "PUBLIC_BOUNDARY_MAP.json",
    "PUBLIC_PORTABILITY_PROFILE.json",
    "PUBLIC_RELEASE_METADATA.json",
    "PUBLIC_RELEASE_REVIEW.md",
    "PUBLIC_EVIDENCE_STRENGTH_MAP.json",
    "PUBLIC_ADOPTION_READINESS.json",
    "PUBLIC_TRACEABILITY_MATRIX.json",
    "PUBLIC_EXAMPLE_COVERAGE.json",
    "PUBLIC_MAINTENANCE_MODEL.json",
    "PUBLIC_CHANGE_CONTROL_MODEL.json",
    "PUBLIC_OWNERSHIP_MAP.json",
    "PUBLIC_DEPENDENCY_GRAPH.json",
    "PUBLIC_ASSURANCE_CASE.json",
    "PUBLIC_UPDATE_COHERENCE_MAP.json",
    "PUBLIC_LIMITATIONS_REGISTER.json",
    "PUBLIC_EVIDENCE_TIMELINE.json",
    "PUBLIC_FRESHNESS_MODEL.json",
    "PUBLIC_ECOSYSTEM_VALUE_MAP.json",
    "PUBLIC_DECISION_LOG.json",
    "PUBLIC_EVIDENCE_GAPS_REGISTER.json",
    "PUBLIC_PROGRAM_FIT_MAP.json",
    "PUBLIC_PUBLICATION_READINESS.json"
  ],
  "strongest_evidence": {
    "contract_surface": [
      "docs/5-element-law.md",
      "docs/16-gates.md",
      "schemas/capsule-schema.json",
      "openapi/validate.openapi.json",
      "schemas/validator-api-envelopes.schema.json"
    ],
    "examples_and_consumability": [
      "examples/example-note.capsule.json",
      "examples/example-project-hub.capsule.json",
      "examples/api/validate-request.single.json",
      "examples/client/node-validate-single.mjs",
      "examples/archive/archive-bundle.sample.json",
      "PUBLIC_EXAMPLE_COVERAGE.json"
    ],
    "governance_and_review": [
      "docs/reviewer-guide.md",
      "docs/public-contract-index.md",
      "docs/repository-identity.md",
      "docs/projection-doctrine.md",
      "docs/domain-boundaries.md",
      "docs/portability.md",
      "docs/maintainer-operations.md",
      "docs/change-control.md",
      "docs/artifact-ownership.md",
      "docs/dependency-graph.md",
      "docs/assurance-case.md",
      "docs/update-coherence.md",
      "docs/limitations-register.md",
      "docs/evidence-timeline.md",
      "docs/review-scorecard.md",
      "docs/verification-matrix.md",
      "docs/audience-paths.md",
      "docs/evidence-strength.md",
      "docs/adoption-readiness.md",
      "docs/freshness.md",
      "docs/ecosystem-value.md",
      "docs/decision-log.md",
      "docs/evidence-gaps.md",
      "docs/program-fit.md",
      "docs/publication-readiness.md"
    ],
    "machine_readable_evidence": [
      "PUBLIC_CONTRACT_CATALOG.json",
      "PUBLIC_REPOSITORY_IDENTITY.json",
      "PUBLIC_PROJECT_PROFILE.json",
      "PUBLIC_CAPABILITY_MATRIX.json",
      "PUBLIC_BOUNDARY_MAP.json",
      "PUBLIC_PORTABILITY_PROFILE.json",
      "PUBLIC_RELEASE_METADATA.json",
      "PUBLIC_TRACEABILITY_MATRIX.json",
      "PUBLIC_MAINTENANCE_MODEL.json",
      "PUBLIC_CHANGE_CONTROL_MODEL.json",
      "PUBLIC_OWNERSHIP_MAP.json",
      "PUBLIC_DEPENDENCY_GRAPH.json",
      "PUBLIC_ASSURANCE_CASE.json",
      "PUBLIC_UPDATE_COHERENCE_MAP.json",
      "PUBLIC_LIMITATIONS_REGISTER.json",
      "PUBLIC_EVIDENCE_TIMELINE.json",
      "PUBLIC_REVIEW_SCORECARD.json",
      "PUBLIC_VERIFICATION_MATRIX.json",
      "PUBLIC_AUDIENCE_PATHS.json",
      "PUBLIC_EVIDENCE_STRENGTH_MAP.json",
      "PUBLIC_ADOPTION_READINESS.json",
      "PUBLIC_FRESHNESS_MODEL.json",
      "PUBLIC_ECOSYSTEM_VALUE_MAP.json",
      "PUBLIC_DECISION_LOG.json",
      "PUBLIC_EVIDENCE_GAPS_REGISTER.json",
      "PUBLIC_PROGRAM_FIT_MAP.json",
      "PUBLIC_PUBLICATION_READINESS.json"
    ]
  },
  "review_commands": [
    "npm run verify:repo"
  ],
  "public_value_claims": [
    "The repo publishes a real public contract surface for CapsuleOS and validator-facing artifacts.",
    "The repo exposes both human-readable and machine-readable evidence for external review.",
    "The repo makes scope, portability posture, and published-vs-deferred boundaries explicit.",
    "The repo makes claim-to-evidence traceability explicit instead of leaving reviewers to infer it from scattered files.",
    "The repo makes public example coverage explicit instead of leaving reviewers to guess which fixtures exercise which contracts.",
    "The repo makes public maintainer workflow and release posture explicit instead of relying on implied maintenance behavior.",
    "The repo makes additive, deprecated, and breaking public-change posture explicit instead of leaving change discipline implied across scattered docs.",
    "The repo makes artifact-family ownership and stronger-source hierarchy explicit instead of leaving authority splits implicit across scattered docs.",
    "The repo makes public artifact dependency and reading-order structure explicit instead of forcing reviewers to infer navigation from filenames or folder order.",
    "The repo makes bounded public claims and explicit non-claims reviewable in one machine-readable assurance layer instead of leaving evaluators to infer scope and limits from scattered docs.",
    "The repo makes required co-movement between reviewer, release, contract, and teaching surfaces explicit instead of leaving release sync as maintainer folklore.",
    "The repo makes deferred scope and non-promised behavior explicit instead of leaving reviewers to infer limits from scattered caveat prose.",
    "The repo makes active maintenance and public-surface hardening visible through a bounded machine-readable timeline instead of requiring reviewers to infer evolution from raw git history.",
    "The repo makes bounded external review criteria explicit through a machine-readable review scorecard instead of leaving maturity assessment to raw counts or intuition.",
    "The repo makes verification coverage explicit through a machine-readable matrix instead of hiding trust in one opaque verify command.",
    "The repo makes audience-specific entry paths explicit instead of assuming one generic repo walkthrough fits reviewers, contributors, integrators, tool-builders, and maintainers equally.",
    "The repo makes stronger-source hierarchy explicit instead of forcing reviewers or integrators to guess which public summaries remain subordinate to schemas, OpenAPI, provenance, and release evidence.",
    "The repo makes public adoption readiness explicit instead of leaving outside readers to infer readiness from examples, audience paths, and scattered caveats.",
    "The repo makes freshness expectations and stale-summary triggers explicit instead of leaving reviewers and programs to guess when public summary layers require refresh.",
    "The repo makes ecosystem value explicit through bounded contracts, reviewer-facing summaries, adoption posture, and release-backed utility instead of relying on vague aspiration.",
    "The repo makes major public design decisions explicit through a bounded decision log instead of forcing reviewers to reverse-engineer intent from tree shape alone.",
    "The repo makes still-open public evidence gaps explicit instead of letting a polished public surface imply maturity that is not yet publicly proven.",
    "The repo makes reviewer/program-fit explicit through a bounded machine-readable layer instead of forcing outside evaluators to infer OSS-support readiness from polish, counts, or aspiration.",
    "The repo makes publication readiness explicit through a bounded machine-readable layer instead of forcing maintainers or reviewers to infer GitHub-publication safety from polish, tree shape, or aspiration.",
    "The repo makes canonical public-repo identity explicit through a bounded machine-readable layer instead of letting package metadata, schema IDs, example URIs, or reviewer summaries drift across renamed slugs."
  ],
  "non_claims": [
    "This packet does not claim to expose the full private N1Hub runtime.",
    "This packet does not claim that every upstream domain is public.",
    "This packet does not replace the stronger underlying docs, schemas, OpenAPI, or release evidence."
  ],
  "residual_risk_surfaces": [
    "PUBLIC_RELEASE_REVIEW.md",
    "PUBLIC_REPOSITORY_IDENTITY.json",
    "PUBLIC_RELEASE_METADATA.json",
    "PUBLIC_FRESHNESS_MODEL.json",
    "PUBLIC_ECOSYSTEM_VALUE_MAP.json",
    "PUBLIC_DECISION_LOG.json",
    "PUBLIC_EVIDENCE_GAPS_REGISTER.json",
    "PUBLIC_PROGRAM_FIT_MAP.json",
    "PUBLIC_PUBLICATION_READINESS.json"
  ]
}
